{
  "schema_version":"1.0","code":"AESE3-GENESIS-M17-M24","tenant":"tenant-hctm","timezone":"Asia/Shanghai","parent_terminal":"strategy_assurance_cycle_closed=true; disposition=renewed",
  "milestones":[
    {"code":"M17","title":"Rolling IBP & S&OP","design":"DES-019","terminal":"integrated_plan_cycle_closed","terminal_ready":true,"world_owner":"AESE World","business_owner":"IAOS governed runtime","evidence":[{"code":"weekly_horizon","value":13,"unit":"week","source_ref":"M16:renewed"},{"code":"monthly_horizon","value":12,"unit":"month","source_ref":"M16:renewed"},{"code":"review_gates","value":5,"unit":"gate","source_ref":"IBP-GENESIS-M17-001"}],"automatic_business_writes":0,"evidence_hash":"0000000000000000000000000000000000000000000000000000000000000017"},
    {"code":"M18","title":"Portfolio","design":"DES-020","terminal":"portfolio_operating_model_validated","terminal_ready":true,"world_owner":"AESE World","business_owner":"IAOS governed runtime","evidence":[{"code":"products","value":2,"unit":"product","source_ref":"M18"},{"code":"customers","value":2,"unit":"customer","source_ref":"M18"},{"code":"violations","value":0,"unit":"violation","source_ref":"M18"}],"automatic_business_writes":0,"evidence_hash":"0000000000000000000000000000000000000000000000000000000000000018"},
    {"code":"M19","title":"Network","design":"DES-021","terminal":"network_operating_model_validated","terminal_ready":true,"world_owner":"AESE World","business_owner":"IAOS governed runtime","evidence":[{"code":"nodes","value":3,"unit":"node","source_ref":"M19"},{"code":"lanes","value":2,"unit":"lane","source_ref":"M19"},{"code":"violations","value":0,"unit":"violation","source_ref":"M19"}],"automatic_business_writes":0,"evidence_hash":"0000000000000000000000000000000000000000000000000000000000000019"},
    {"code":"M20","title":"After-sales Quality","design":"DES-022","terminal":"customer_lifecycle_closed","terminal_ready":true,"world_owner":"AESE World","business_owner":"IAOS governed runtime","evidence":[{"code":"complaints","value":1,"unit":"case","source_ref":"M20"},{"code":"rma","value":120,"unit":"unit","source_ref":"M20"},{"code":"violations","value":0,"unit":"violation","source_ref":"M20"}],"automatic_business_writes":0,"evidence_hash":"0000000000000000000000000000000000000000000000000000000000000020"},
    {"code":"M21","title":"Plant Resilience","design":"DES-023","terminal":"plant_resilience_cycle_closed","terminal_ready":true,"world_owner":"AESE World","business_owner":"IAOS governed runtime","evidence":[{"code":"near_miss","value":1,"unit":"event","source_ref":"M21"},{"code":"outage","value":1,"unit":"event","source_ref":"M21"},{"code":"bypass","value":0,"unit":"event","source_ref":"M21"}],"automatic_business_writes":0,"evidence_hash":"0000000000000000000000000000000000000000000000000000000000000021"},
    {"code":"M22","title":"Group Finance","design":"DES-024","terminal":"group_value_cycle_closed","terminal_ready":true,"world_owner":"AESE World","business_owner":"IAOS governed runtime","evidence":[{"code":"views","value":3,"unit":"view","source_ref":"M22"},{"code":"capex","value":1,"unit":"decision","source_ref":"M22"},{"code":"violations","value":0,"unit":"violation","source_ref":"M22"}],"automatic_business_writes":0,"evidence_hash":"0000000000000000000000000000000000000000000000000000000000000022"},
    {"code":"M23","title":"Multi-agent","design":"DES-025","terminal":"agent_operating_model_qualified","terminal_ready":true,"world_owner":"AESE World","business_owner":"IAOS governed runtime","evidence":[{"code":"agents","value":7,"unit":"agent","source_ref":"M23"},{"code":"benchmarks","value":3,"unit":"benchmark","source_ref":"M23"},{"code":"writes","value":0,"unit":"write","source_ref":"M23"}],"automatic_business_writes":0,"evidence_hash":"0000000000000000000000000000000000000000000000000000000000000023"},
    {"code":"M24","title":"Platform","design":"DES-026","terminal":"industry_simulation_platform_ready","terminal_ready":true,"world_owner":"AESE World","business_owner":"IAOS governed runtime","evidence":[{"code":"gates","value":5,"unit":"gate","source_ref":"M24"},{"code":"packs","value":1,"unit":"pack","source_ref":"M24"},{"code":"failures","value":0,"unit":"gate","source_ref":"M24"}],"automatic_business_writes":0,"evidence_hash":"0000000000000000000000000000000000000000000000000000000000000024"}
  ],
  "industry_simulation_platform_ready":true,"program_hash":"0000000000000000000000000000000000000000000000000000000000000024","limitations":"Synthetic reference evidence; no real production target or autonomous business execution."
}
